{
  "dataSourceUri": "/public/Samples/Data_Sources/FoodmartDataSource",
  "folder": "/reports/supermart",
  "name": "supermart_dashboard_improved",
  "label": "Supermart Executive Dashboard (Improved)",
  "outDir": "report\\supermart",
  "dashlets": [
    {
      "kind": "text", "name": "Header",
      "text": "Supermart Executive Dashboard",
      "size": 22, "bold": true, "align": "center",
      "color": "rgb(255,255,255)", "background": "rgb(25,42,86)",
      "x": 0, "y": 0, "width": 40, "height": 3
    },
    {
      "name": "supermart_kpi", "title": "Key Performance Indicators",
      "x": 0, "y": 3, "width": 40, "height": 6
    },
    {
      "name": "supermart_yoy_sales", "title": "Year-over-Year Sales (1997 vs 1998)",
      "x": 0, "y": 9, "width": 40, "height": 11
    },
    {
      "name": "supermart_sales_by_family", "title": "Sales by Product Family",
      "x": 0, "y": 20, "width": 13, "height": 11
    },
    {
      "name": "supermart_top_categories", "title": "Top 10 Product Categories",
      "x": 13, "y": 20, "width": 14, "height": 11
    },
    {
      "name": "supermart_sales_by_state", "title": "Sales by State",
      "x": 27, "y": 20, "width": 13, "height": 11
    },
    {
      "name": "supermart_monthly_sales", "title": "Monthly Sales Trend",
      "x": 0, "y": 31, "width": 20, "height": 11
    },
    {
      "name": "supermart_quarterly_sales_by_family", "title": "Quarterly Sales by Family",
      "x": 20, "y": 31, "width": 20, "height": 11
    },
    {
      "name": "supermart_store_profit", "title": "Profit by Store",
      "x": 0, "y": 42, "width": 20, "height": 11
    },
    {
      "name": "supermart_promotion_effectiveness", "title": "Promotion Effectiveness",
      "x": 20, "y": 42, "width": 20, "height": 11
    },
    {
      "kind": "text", "name": "Footer",
      "text": "Source: Foodmart sample database  ·  Fiscal year 1997  ·  Built with the jasper-deploy toolkit",
      "size": 10, "align": "center",
      "color": "rgb(120,130,150)",
      "x": 0, "y": 53, "width": 40, "height": 2
    }
  ]
}
